{
  "schema_version": "1.0.0",
  "query_id": "query-scope-isolation",
  "ordering_strategy": "canonical",
  "scope": {
    "named_graph_scope": "actor",
    "scope_ref": "nostra://actor/did:nostra:research-steward"
  },
  "filters": {
    "subject": "nostra://contribution/exp-run-001",
    "predicate": "research:tests_hypothesis",
    "object": "nostra://contribution/hyp-001",
    "include_provenance": true,
    "limit": 10,
    "offset": 0
  }
}
