{
  "schema_version": "1.0.0",
  "query_id": "query-any-scope-hypothesis-links",
  "ordering_strategy": "canonical",
  "scope": {
    "named_graph_scope": "any"
  },
  "filters": {
    "subject": "nostra://contribution/hyp-001",
    "predicate": "relates_to",
    "include_provenance": true,
    "limit": 10,
    "offset": 0
  }
}
